{
  "$schema": "https://raw.githubusercontent.com/Bitcadia/Authority/main/schemas/mod-registry-v1.schema.json",
  "schemaVersion": 1,
  "generatedAt": "2026-08-28T00:08:50Z",
  "notice": "Live index of original-site patch URLs for Smash Remix. This catalog contains no ROM data. Patch files are not redistributed; clients fetch them from the publisher's original HTTPS URLs.",
  "entries": [
    {
      "id": "smashremix-2.0.1-ntsc",
      "name": "Smash Remix",
      "version": "2.0.1",
      "authors": [
        "Smash Remix Team"
      ],
      "projectUrl": "https://smashremix.net/patcher/",
      "source": {
        "provider": "smashremix.net",
        "metadataUrl": "https://smashremix.net/patcher/patches/releases.json",
        "retrievedAt": "2026-08-28T00:08:50Z"
      },
      "base": {
        "name": "Super Smash Bros.",
        "variant": "USA",
        "gameCode": "NALE",
        "normalizedCrc32": "EB97929E",
        "normalizedSha256": "15592E79D3C5295CEF4371D4992F0BD25BEC2102FC29644C93E682F7EA99EF3D"
      },
      "patch": {
        "format": "vcdiff",
        "url": "https://smashremix.net/patcher/patches/releases/smashremix2.0.1.xdelta",
        "size": 35204600,
        "sha256": "2E9A36AC89705327726C5693105DB7240CAD757DDF27CB44A62372987F5556DA",
        "vcdiffProfile": "rfc3284-default-code-table-no-secondary-compression",
        "allowRedirects": false
      },
      "compatibility": "tested-on-hardware",
      "saveType": "sram",
      "rights": {
        "patchRedistributionAllowed": false,
        "artworkRedistributionAllowed": false
      }
    }
  ]
}
