{"$schema":"https://raw.githubusercontent.com/Bitcadia/Authority/main/schemas/mod-registry-v1.schema.json","schemaVersion":1,"generatedAt":"2026-08-31T02:40:58.513Z","notice":"Live index of original-site patch URLs from Hylian Modding and named publishers. This catalog contains no ROM data. Patch files are not redistributed; clients fetch exact pinned artifacts from their original HTTPS URLs.","entries":[{"id":"hylian-majoras_mask_chaos_edition","name":"Majora's Mask: Chaos Edition","version":"0.5.7","authors":["GabrielCNoble"],"projectUrl":"https://hylianmodding.com/mods/majora's_mask_chaos_edition/","source":{"provider":"hylianmodding.com","metadataUrl":"https://hylianmodding.com/mods/majora's_mask_chaos_edition/mod.json","retrievedAt":"2026-08-31T02:40:58.513Z"},"base":{"name":"The Legend of Zelda: Majora's Mask","variant":"USA","gameCode":"NZSE","normalizedCrc32":"B428D8A7","normalizedSha256":"EFB1365B3AE362604514C0F9A1A2D11F5DC8688BA5BE660A37DEBF5E3BE43F2B"},"patch":{"format":"bps","url":"https://github.com/GabrielCNoble/mm-chaos/releases/download/v0.5.7/Majoras_Mask_Chaos_Edition_v0.5.7.bps","size":6063489,"sha256":"F5E95E6290F9E594C60593794B92B9F45F5021B5C9E5A53F6CF7AE1B39BE6A3C","allowRedirects":true,"sourceCrc32":"B428D8A7","targetCrc32":"3D2F6C2F","patchCrc32":"0048600F"},"output":{},"compatibility":"complete","saveType":"sram","rights":{"patchRedistributionAllowed":false,"artworkRedistributionAllowed":false},"artwork":{"url":"https://hylianmodding.com/mods/majora's_mask_chaos_edition/screenshots/thumbnail.png","size":405759,"sha256":"6D5A048FE0854921108CA864DF54AC28F1E1373347106406F5F867EE34F6EEB6","sourcePage":"https://hylianmodding.com/mods/majora's_mask_chaos_edition/","allowRedirects":false}},{"id":"hylian-majoras_mask_masked_quest","name":"Majora's Mask Masked Quest","version":"2021-01-02","authors":["Garo-Mastah"],"projectUrl":"https://hylianmodding.com/mods/majora's_mask_masked_quest/","source":{"provider":"hylianmodding.com","metadataUrl":"https://hylianmodding.com/mods/majora's_mask_masked_quest/mod.json","retrievedAt":"2026-08-31T02:40:58.513Z"},"base":{"name":"The Legend of Zelda: Majora's Mask","variant":"USA","gameCode":"NZSE","normalizedCrc32":"B428D8A7","normalizedSha256":"EFB1365B3AE362604514C0F9A1A2D11F5DC8688BA5BE660A37DEBF5E3BE43F2B"},"patch":{"format":"bps","url":"https://hylianmodding.com/mods/majora's_mask_masked_quest/downloads/MajoraMQ.zip","size":13838244,"sha256":"49F0B2CD81FEA1ECCF04EF37AC0AB5685376491F44F62F2AF663078102307E88","allowRedirects":false,"archiveMember":"MajoraP.bps","memberSize":3119087,"memberSha256":"811570287D2237113553E691E0624888AEDC2A7B84378EE9FD776E79AC554B9B","sourceCrc32":"B428D8A7","targetCrc32":"5C60EB0C","patchCrc32":"F12F70A9"},"output":{},"compatibility":"demo","saveType":"sram","rights":{"patchRedistributionAllowed":false,"artworkRedistributionAllowed":false},"artwork":{"url":"https://hylianmodding.com/mods/majora's_mask_masked_quest/screenshots/thumbnail.jpg","size":90035,"sha256":"2BEF29CB3E156FFBBBFEFB03ED204264580AC18C64499349B7FCF37056A9FABC","sourcePage":"https://hylianmodding.com/mods/majora's_mask_masked_quest/","allowRedirects":false}},{"id":"hylian-majoras_mask_master_quest","name":"Majora's Mask Master Quest","version":"1.2","authors":["DeathBasket"],"projectUrl":"https://hylianmodding.com/mods/majora's_mask_master_quest/","source":{"provider":"hylianmodding.com","metadataUrl":"https://hylianmodding.com/mods/majora's_mask_master_quest/mod.json","retrievedAt":"2026-08-31T02:40:58.513Z"},"base":{"name":"The Legend of Zelda: Majora's Mask","variant":"USA","gameCode":"NZSE","normalizedCrc32":"B428D8A7","normalizedSha256":"EFB1365B3AE362604514C0F9A1A2D11F5DC8688BA5BE660A37DEBF5E3BE43F2B"},"patch":{"format":"bps","url":"https://hylianmodding.com/mods/majora's_mask_master_quest/downloads/LoZMM-MasterQuest.zip","size":754057,"sha256":"74F6350DB3969E203CF2753FC35AED07C5B6946FC5EB84B49DBF370E79611894","allowRedirects":false,"archiveMember":"Legend of Zelda, The - Majora's Mask - Master Quest (v1.2) (DeathbBasket).bps","memberSize":1164951,"memberSha256":"DB9A2434247EB14C110A7ABDEC640216986EF273E49E0ACFA35C093FEEC139C6","sourceCrc32":"B428D8A7","targetCrc32":"49EAC960","patchCrc32":"5C859DF4"},"output":{},"compatibility":"complete","saveType":"sram","rights":{"patchRedistributionAllowed":false,"artworkRedistributionAllowed":false},"artwork":{"url":"https://hylianmodding.com/mods/majora's_mask_master_quest/screenshots/thumbnail.png","size":20354,"sha256":"A9EC63524B002D265C95B9ABB02B6F745C47C00ED0B402E1AA0FF8E9F8DEC51B","sourcePage":"https://hylianmodding.com/mods/majora's_mask_master_quest/","allowRedirects":false}},{"id":"hylian-pumkin_tower","name":"Pumkin Tower","version":"1.1.1","authors":["Chadlight","Corrhaid","Javarooster"],"projectUrl":"https://hylianmodding.com/mods/pumkin_tower/","source":{"provider":"hylianmodding.com","metadataUrl":"https://hylianmodding.com/mods/pumkin_tower/mod.json","retrievedAt":"2026-08-31T02:40:58.513Z"},"base":{"name":"The Legend of Zelda: Majora's Mask","variant":"USA","gameCode":"NZSE","normalizedCrc32":"B428D8A7","normalizedSha256":"EFB1365B3AE362604514C0F9A1A2D11F5DC8688BA5BE660A37DEBF5E3BE43F2B"},"patch":{"format":"bps","url":"https://hylianmodding.com/mods/pumkin_tower/downloads/PumkinPatch1.1.1.bps","size":54342259,"sha256":"0FEEF125339A4FFBCBE5310A23246C5D8009B57CD6AF89888456EC2C58966113","allowRedirects":false,"sourceCrc32":"B428D8A7","targetCrc32":"E2F04902","patchCrc32":"3A0BA8AE"},"output":{},"compatibility":"complete","saveType":"sram","rights":{"patchRedistributionAllowed":false,"artworkRedistributionAllowed":false},"artwork":{"url":"https://hylianmodding.com/mods/pumkin_tower/screenshots/thumbnail.png","size":598223,"sha256":"20D2F31A3DE8FDF5214F8A67A801780121FB14C12EEF2616B3B26F008789970D","sourcePage":"https://hylianmodding.com/mods/pumkin_tower/","allowRedirects":false}},{"id":"hylian-zelda_revival","name":"Zelda Revival","version":"1.1","authors":["Don Camilo"],"projectUrl":"https://hylianmodding.com/mods/zelda_revival/","source":{"provider":"hylianmodding.com","metadataUrl":"https://hylianmodding.com/mods/zelda_revival/mod.json","retrievedAt":"2026-08-31T02:40:58.513Z"},"base":{"name":"The Legend of Zelda: Majora's Mask","variant":"USA","gameCode":"NZSE","normalizedCrc32":"B428D8A7","normalizedSha256":"EFB1365B3AE362604514C0F9A1A2D11F5DC8688BA5BE660A37DEBF5E3BE43F2B"},"patch":{"format":"bps","url":"https://hylianmodding.com/mods/zelda_revival/downloads/zelda_revival.zip","size":12463819,"sha256":"290120EC484CE5B596D2895FA825EAF99B37C2C6553689960A0C0BDC66AB5ED8","allowRedirects":false,"archiveMember":"Legend of Zelda, The - Majora's Mask - Zelda Revival (v1.1) (doncamilo).bps","memberSize":13926783,"memberSha256":"82547E53A60B17FF5DA758AF3C0FC3912ACB97AA67437ABEF9FBD4B440B2343B","sourceCrc32":"B428D8A7","targetCrc32":"79045D46","patchCrc32":"99DAFA91"},"output":{},"compatibility":"complete","saveType":"sram","rights":{"patchRedistributionAllowed":false,"artworkRedistributionAllowed":false},"artwork":{"url":"https://hylianmodding.com/mods/zelda_revival/screenshots/thumbnail.png","size":100507,"sha256":"F1E3EBFF1D7058CB70A56B452FA57D6667D8C5E951239006C3E2EF3A380EE42A","sourcePage":"https://hylianmodding.com/mods/zelda_revival/","allowRedirects":false}}]}
